{
  "slug": "norac-nesting-tables",
  "name": "Norac oak nesting tables",
  "subtitle": "The natural character of wood",
  "summary": "The natural character of wood. A considered, simple design for everyday living.",
  "description": "The natural character of wood. A considered, simple design for everyday living. Visit our Nicosia store to explore proportions and find the right arrangement for your room.",
  "care": "Ask our team for care advice specific to your chosen fabric and finish.",
  "seo": {
    "title": "Norac oak nesting tables | Normod Cyprus",
    "description": "Norac oak nesting tables. The natural character of wood. A considered, simple design for everyday living. Discover it at our Cyprus store."
  }
}
