{
  "slug": "marn-coffee-table",
  "name": "Marn lacquer coffee table",
  "subtitle": "Matt lacquer finish",
  "summary": "Matt lacquer finish. A considered, simple design for everyday living.",
  "description": "Matt lacquer finish. A considered, simple design for everyday living. Visit our Nicosia store to explore proportions and find the right arrangement for your room.",
  "care": "Wipe with a soft, slightly damp cloth and dry. Use a protective mat under hot objects.",
  "seo": {
    "title": "Marn lacquer coffee table | Normod Cyprus",
    "description": "Marn lacquer coffee table. Matt lacquer finish. A considered, simple design for everyday living. Discover it at our Cyprus store."
  }
}
