{
  "slug": "carle-uzanmali-koltuk",
  "name": "Carle uzanmalı koltuk",
  "subtitle": "Doğal dokulu döşeme",
  "summary": "Doğal dokulu döşeme. Oturma alanını evinin ritmine göre şekillendir.",
  "description": "Doğal dokulu döşeme. Oturma alanını evinin ritmine göre şekillendir. Ölçüleri ve mekânındaki yerleşimi birlikte değerlendirmek için Lefkoşa mağazamızı ziyaret et.",
  "care": "Seçtiğin kumaş ve yüzeye uygun bakım önerilerini mağazamızdan öğrenebilirsin.",
  "seo": {
    "title": "Carle uzanmalı koltuk | Normod Kıbrıs",
    "description": "Carle uzanmalı koltuk. Doğal dokulu döşeme. Oturma alanını evinin ritmine göre şekillendir. Kıbrıs mağazamızda keşfet."
  }
}
