{
  "slug": "carle-sofa-and-pouffe",
  "name": "Carle sofa & pouffe",
  "subtitle": "Bouclé upholstery",
  "summary": "Bouclé upholstery. Shape your living space around your everyday life.",
  "description": "Bouclé upholstery. Shape your living space around your everyday life. Visit our Nicosia store to explore proportions and find the right arrangement for your room.",
  "care": "Ask our team for care advice specific to your chosen fabric and finish.",
  "seo": {
    "title": "Carle sofa & pouffe | Normod Cyprus",
    "description": "Carle sofa & pouffe. Bouclé upholstery. Shape your living space around your everyday life. Discover it at our Cyprus store."
  }
}
