{
  "slug": "carle-uclu-koltuk",
  "name": "Carle üçlü koltuk",
  "subtitle": "Ahşap ayak, kadife döşeme",
  "summary": "Ahşap ayak, kadife döşeme. Oturma alanını evinin ritmine göre şekillendir.",
  "description": "Ahşap ayak, kadife döşeme. Oturma alanını evinin ritmine göre şekillendir. Ölçüleri ve mekânındaki yerleşimi birlikte değerlendirmek için Lefkoşa mağazamızı ziyaret et.",
  "care": "Seçtiğin kumaş ve yüzeye uygun bakım önerilerini mağazamızdan öğrenebilirsin.",
  "seo": {
    "title": "Carle üçlü koltuk | Normod Kıbrıs",
    "description": "Carle üçlü koltuk. Ahşap ayak, kadife döşeme. Oturma alanını evinin ritmine göre şekillendir. Kıbrıs mağazamızda keşfet."
  }
}
