{
  "slug": "klem-uclu-koltuk",
  "name": "Klem üçlü koltuk",
  "subtitle": "Ahşap ayak, kadife döşeme",
  "summary": "Ahşap ayak, kadife döşeme. Oturma alanını evinin ritmine göre şekillendir.",
  "description": "Ahşap ayak, kadife döşeme. Oturma alanını evinin ritmine göre şekillendir. Ölçüleri ve mekânındaki yerleşimi birlikte değerlendirmek için Lefkoşa mağazamızı ziyaret et.",
  "care": "Seçtiğin kumaş ve yüzeye uygun bakım önerilerini mağazamızdan öğrenebilirsin.",
  "seo": {
    "title": "Klem üçlü koltuk | Normod Kıbrıs",
    "description": "Klem üçlü koltuk. Ahşap ayak, kadife döşeme. Oturma alanını evinin ritmine göre şekillendir. Kıbrıs mağazamızda keşfet."
  }
}
