{
  "slug": "marn-lake-orta-sehpa",
  "name": "Marn lake orta sehpa",
  "subtitle": "Mat lake yüzey",
  "summary": "Mat lake yüzey. Günlük yaşam için düşünülmüş sade bir tasarım.",
  "description": "Mat lake yüzey. Günlük yaşam için düşünülmüş sade bir tasarım. Ölçüleri ve mekânındaki yerleşimi birlikte değerlendirmek için Lefkoşa mağazamızı ziyaret et.",
  "care": "Yumuşak, hafif nemli bir bezle sil ve kurula. Sıcak objeler için koruyucu altlık kullan.",
  "seo": {
    "title": "Marn lake orta sehpa | Normod Kıbrıs",
    "description": "Marn lake orta sehpa. Mat lake yüzey. Günlük yaşam için düşünülmüş sade bir tasarım. Kıbrıs mağazamızda keşfet."
  }
}
