{
  "slug": "klem-armchair",
  "name": "Klem armchair",
  "subtitle": "Wooden legs, velvet upholstery",
  "summary": "Wooden legs, velvet upholstery. Shape your living space around your everyday life.",
  "description": "Wooden legs, velvet upholstery. Shape your living space around your everyday life. Visit our Nicosia store to explore proportions and find the right arrangement for your room.",
  "care": "Ask our team for care advice specific to your chosen fabric and finish.",
  "seo": {
    "title": "Klem armchair | Normod Cyprus",
    "description": "Klem armchair. Wooden legs, velvet upholstery. Shape your living space around your everyday life. Discover it at our Cyprus store."
  }
}
