{
  "slug": "carle-sofa-with-chaise",
  "name": "Carle sofa with chaise",
  "subtitle": "Natural-texture upholstery",
  "summary": "Natural-texture upholstery. Shape your living space around your everyday life.",
  "description": "Natural-texture upholstery. Shape your living space around your everyday life. Visit our Nicosia store to explore proportions and find the right arrangement for your room.",
  "care": "Ask our team for care advice specific to your chosen fabric and finish.",
  "seo": {
    "title": "Carle sofa with chaise | Normod Cyprus",
    "description": "Carle sofa with chaise. Natural-texture upholstery. Shape your living space around your everyday life. Discover it at our Cyprus store."
  }
}
