{
  "slug": "carle-koltuk-ve-puf",
  "name": "Carle koltuk ve puf",
  "subtitle": "Bukle döşeme",
  "summary": "Bukle döşeme. Oturma alanını evinin ritmine göre şekillendir.",
  "description": "Bukle döşeme. Oturma alanını evinin ritmine göre şekillendir. Ölçüleri ve mekânındaki yerleşimi birlikte değerlendirmek için Lefkoşa mağazamızı ziyaret et.",
  "care": "Seçtiğin kumaş ve yüzeye uygun bakım önerilerini mağazamızdan öğrenebilirsin.",
  "seo": {
    "title": "Carle koltuk ve puf | Normod Kıbrıs",
    "description": "Carle koltuk ve puf. Bukle döşeme. Oturma alanını evinin ritmine göre şekillendir. Kıbrıs mağazamızda keşfet."
  }
}
