{
  "slug": "norac-ahsap-karyola",
  "name": "Norac ahşap karyola",
  "subtitle": "Ahşabın doğal karakteri",
  "summary": "Ahşabın doğal karakteri. Günlük yaşam için düşünülmüş sade bir tasarım.",
  "description": "Ahşabın doğal karakteri. Günlük yaşam için düşünülmüş sade bir tasarım. Ölçüleri ve mekânındaki yerleşimi birlikte değerlendirmek için Lefkoşa mağazamızı ziyaret et.",
  "care": "Seçtiğin kumaş ve yüzeye uygun bakım önerilerini mağazamızdan öğrenebilirsin.",
  "seo": {
    "title": "Norac ahşap karyola | Normod Kıbrıs",
    "description": "Norac ahşap karyola. Ahşabın doğal karakteri. Günlük yaşam için düşünülmüş sade bir tasarım. Kıbrıs mağazamızda keşfet."
  }
}
